id,name,street,adress,pow_teryt,gmina_town,phone,url
point-20852,Bank Spółdzielczy w Zambrowie,ul. Białostocka 2,18-300 Zambrów,2014,zambrow,Tel: 86 271-07-32,bszambrow.pl
point-26162,Bank Spółdzielczy w Łomży Oddział w Zambrowie,Aleja Wojska Polskiego 6,18-300 Zambrów,2014,zambrow,Tel: 86 271-26-82,bslomza.pl
point-26865,Bank Spółdzielczy w Zambrowie Filia nr 3 w Zambrowie,ul. Aleja Wojska Polskiego 8 lok. 1,18-300 Zambrów,2014,zambrow,Tel: 797-700-790,bszambrow.pl
point-26864,Bank Spółdzielczy w Zambrowie Punkt Obsługi Klienta w Zambrowie - Starostwo,ul. Fabryczna 3,18-300 Zambrów,2014,zambrow,Tel: 86 276-11-33,bszambrow.pl
point-26863,Bank Spółdzielczy w Zambrowie Filia nr 2 w Zambrowie ZAMTEX,Aleja Wojska Polskiego 27,18-300 Zambrów,2014,zambrow,Tel: 86 276-11-31,bszambrow.pl
