id,name,street,adress,pow_teryt,gmina_town,phone,url
point-25905,Bank Spółdzielczy w Kielcach Oddział w Obrazowie,Obrazów 105,27-641 Obrazów,2609,wilczyce,Tel: 41 836-57-93,bskielce.com.pl
point-25888,Bank Spółdzielczy w Kielcach Oddział w Dwikozach,ul. Spółdzielcza 2,27-620 Dwikozy,2609,wilczyce,Tel: 15 831-14-12,bskielce.com.pl
point-26732,Bank Spółdzielczy w Tarnobrzegu Oddział w Bidzinach,Bidziny 124,27-533 Bidziny,2609,wilczyce,Tel: 15 861-83-18,bstarnobrzeg.pl
point-26728,Bank Spółdzielczy w Tarnobrzegu Oddział w Lipniku,Lipnik 21,27-540 Lipnik,2609,wilczyce,Tel: 15 869-14-16,bstarnobrzeg.pl
point-26735,Bank Spółdzielczy w Tarnobrzegu Oddział w Bidzianach Filia w Wojciechowicach,Wojciechowice 50,27-532 Wojciechowice,2609,wilczyce,Tel: 15 861-40-13,bstarnobrzeg.pl
point-26727,Bank Spółdzielczy w Tarnobrzegu Oddział w Gorzycach,ul. Piłsudskiego 1,39-432 Gorzyce,2609,wilczyce,Tel: 15 836-22-19,bstarnobrzeg.pl
point-25902,Bank Spółdzielczy w Kielcach Filia w Opatowie,ul. Sienkiewicza 17,27-500 Opatów,2609,wilczyce,Tel: 15 868-40-64,bskielce.com.pl
point-27004,Nadwiślański Bank Spółdzielczy w Solcu-Zdroju Oddział w Klimontowie,ul. dr. J. Zysmana 2,27-640 Klimontów,2609,wilczyce,Tel: 15 866-10-13,nbsbank.pl
