id,name,street,adress,pow_teryt,gmina_town,phone,url
point-26868,Bank Spółdzielczy w Zatorze Oddział w Bielsku-Białej,ul. Wyzwolenia 1,43-300 Bielsko-Biała,2461,bielsko-biala,Tel: 33 816-18-85,bszator.pl
point-25567,Beskidzki Bank Spółdzielczy Filia nr 1 w Bielsku-Białej,ul. Barlickiego 2,43-300 Bielsko-Biała,2461,bielsko-biala,Tel: 33 822-82-44,bankbbs.pl
point-25593,Bank Spółdzielczy Ziem Górskich KARPATIA Filia w Bielsku-Białej,ul. Stefanii Sempołowskiej 21,43-300 Bielsko-Biała,2461,bielsko-biala,Tel: 33 819-05-00,karpatiabs.pl
point-23581,Beskidzki Bank Spółdzielczy,ul. Komorowicka 272,43-346 Bielsko-Biała,2461,bielsko-biala,Tel: 33 815-79-34,bankbbs.pl
point-25568,Beskidzki Bank Spółdzielczy Oddział w Bielsku-Białej,ul. Komorowicka 272,43-346 Biesko-Biała,2461,bielsko-biala,Tel: 33 815-79-34,bankbbs.pl
point-25565,Beskidzki Bank Spółdzielczy Filia nr 2 w Kozach,ul. Krakowska 11,43-340 Kozy,2461,bielsko-biala,Tel: 33 817-42-78,bankbbs.pl
point-25797,Bank Spółdzielczy w Jasienicy Filia w Jaworzu,ul. Zdrojowa 81,43-384 Jaworze,2461,bielsko-biala,Tel: 33 817-26-75,bsjasienica.pl
point-25467,ABS Bank Spółdzielczy Filia w Pisarzowicach,ul. Świętego Floriana 24,43-332 Pisarzowice,2461,bielsko-biala,Tel: 33 845-75-13,absbank.pl
