id,name,street,adress,pow_teryt,gmina_town,phone,url
point-25474,Bank Spółdzielczy w Barcinie Punkt Kasowy w Barcinie,ul. Lotników 13,88-190 Barcin,3021,swarzedz,Tel: 52 383-30-19,bsbarcin.pl
point-23491,Bank Spółdzielczy w Barcinie,ul. Kościelna 8,88-190 Barcin,3021,swarzedz,Tel: 52 383-27-10,bsbarcin.pl
point-25475,Bank Spółdzielczy w Barcinie Punkt Kasowy w Piechcinie,ul. Wiertników 1,88-192 Piechcin,3021,swarzedz,Tel: 52 383-75-53,bsbarcin.pl
point-24840,Bank Spółdzielczy w Wysokiej,ul. Strzelecka 1,89-320 Wysoka,3021,swarzedz,Tel: 67 287-10-24,bswysoka.pl
point-26210,Bank Spółdzielczy w Miliczu Oddział w Cieszkowie,Pl. Rynek 6a,56-330 Cieszków,3021,swarzedz,Tel: 71 384-82-54,bsmilicz.com.pl
point-26302,Bank Spółdzielczy w Nowej Soli Filia w Sławie,ul. Odrodzonego Wojska Polskiego 7,67-410 Sława,3021,swarzedz,Tel: 68 356-61-65,bsnowasol.pl
point-26303,Bank Spółdzielczy w Nowej Soli Punkt Kasowy w Kolsku,ul. Piastowska 10/2,67-415 Kolsko,3021,swarzedz,Tel: 68 352-46-52,bsnowasol.pl
point-25974,Bank Spółdzielczy w Kożuchowie Oddział w Kargowej,ul. Rynek 2,66-120 Kargowa,3021,swarzedz,Tel: 68 320-76-52,bskozuchow.pl
point-26215,Bank Spółdzielczy w Miliczu POK w Gądkowicach,Gądkowice 45,56-300 Milicz,3021,swarzedz,Tel: 71 384-54-02,bsmilicz.com.pl
point-26301,Bank Spółdzielczy w Nowej Soli Filia w Bojadłach,ul. Sulechowska 11,66-130 Bojadła,3021,swarzedz,Tel: 68 352-33-70,bsnowasol.pl
point-25977,Bank Spółdzielczy w Kożuchowie Filia w Trzebiechowie,ul. Aleja Lipowa 2,66-132 Trzebiechów,3021,swarzedz,Tel: 68 351-42-22,bskozuchow.pl
point-27099,Powiślański Bank Spółdzielczy w Kwidzynie Filia w Bydgoszczy,ul. Kijowska 54,85-703 Bydgoszcz,3021,swarzedz,Tel: 52 321-11-48,powislanski.pl
point-25697,Bank Spółdzielczy w Głogowie Filia w Pęcławiu,Pęcław 28,67-221 Pęcław,3021,swarzedz,Tel: 76 831-70-04,bsglogow.pl
point-25696,Bank Spółdzielczy w Głogowie Oddział w Głogowie,ul. Grodzka 37,67-200 Głogów,3021,swarzedz,Tel: 76 835-74-23,bsglogow.pl
point-23713,Bank Spółdzielczy w Głogowie,ul. Sikorskiego 15,67-210 Głogów,3021,swarzedz,Tel: 76 835-74-14,bsglogow.pl
point-26305,Bank Spółdzielczy w Nowej Soli Punkt Kasowy w Otyniu,ul. Rynek 1,67-106 Otyń,3021,swarzedz,Tel: 68 378-24-96,bsnowasol.pl
point-26304,Bank Spółdzielczy w Nowej Soli Punkt Kasowy w Siedlisku,Plac Zamkowy 6,67-112 Siedlisko,3021,swarzedz,Tel: 68 388-32-19,bsnowasol.pl
point-26300,Bank Spółdzielczy w Nowej Soli Oddział w Bytomiu Odrzańskim,ul. Szkolna 1,67-115 Bytom Odrzański,3021,swarzedz,Tel: 68 388-40-44,bsnowasol.pl
point-25698,Bank Spółdzielczy w Głogowie Filia w Jerzmanowej,ul. Lipowa 4,67-222 Jerzmanowa,3021,swarzedz,Tel: 76 835-74-19,bsglogow.pl
point-24318,Bank Spółdzielczy w Nowej Soli,ul. Bankowa 1,67-100 Nowa Sól,3021,swarzedz,Tel: 68 387-52-71,bsnowasol.pl
point-25978,Bank Spółdzielczy w Kożuchowie Oddział w Nowej Soli,Os. Konstytucji 3 Maja 9D,67-100 Nowa Sól,3021,swarzedz,Tel: 68 387-61-01,bskozuchow.pl
point-25479,Gospodarczy Bank Spółdzielczy w Barlinku Oddział w Bierzwniku,ul. Kopernika 1,73-240 Bierzwnik,3021,swarzedz,Tel: 95 22 23 390,gbsbank.pl
point-26784,Bank Spółdzielczy w Warcie Punkt Obsługi Klienta w Goszczanowie,ul. Kaliska 15,98-215 Goszczanów,3021,swarzedz,Tel: 43 829-04-31,bs-warta.pl
point-26029,Bank Spółdzielczy w Legnicy Oddział w Gaworzycach,ul. Bankowa 189b,59-180 Gaworzyce,3021,swarzedz,Tel: 76 831-62-12,bslegnica.pl
point-26030,Bank Spółdzielczy w Legnicy Filia w Radwanicach,ul. Głogowska 17,59-160 Radwanice,3021,swarzedz,Tel: 76 831-14-22,bslegnica.pl
point-25975,Bank Spółdzielczy w Kożuchowie Oddział w Nowym Miasteczku,ul. Rynek 25,67-124 Nowe Miasteczko,3021,swarzedz,Tel: 68 388-80-19,bskozuchow.pl
point-25979,Bank Spółdzielczy w Kożuchowie Filia nr 2 w Kożuchowie,ul. 22 Lipca 1807 32,67-120 Kożuchów,3021,swarzedz,Tel: 68 355-35-26,bskozuchow.pl
point-23993,Bank Spółdzielczy w Kożuchowie,ul. Klasztorna 4,67-120 Kożuchów,3021,swarzedz,Tel: 68 355-20-24,bskozuchow.pl
point-25976,Bank Spółdzielczy w Kożuchowie Oddział w Kożuchowie,ul. Klasztorna 4,67-120 Kożuchów,3021,swarzedz,Tel: 68 355-75-22,bskozuchow.pl
point-26420,Bank Spółdzielczy w Poddębicach Oddział w Uniejowie,ul. Biskupa Wojciecha Owczarka 6,99-210 Uniejów,3021,swarzedz,Tel: 63 288-81-31,bspoddebice.pl
point-26421,Bank Spółdzielczy w Poddębicach Filia w Pęczniewie,ul. Rynek 2,99-235 Pęczniew,3021,swarzedz,Tel: 43 678-15-11,bspoddebice.pl
point-26894,Bank Spółdzielczy w Żaganiu Punkt Obsługi Klienta w Niegosławicach,Niegosławice 55,67-312 Niegosławice,3021,swarzedz,Tel: 68 378-14-10,bszagan.pl
point-26785,Bank Spółdzielczy w Warcie Punkt Kasowy Warta,ul. Reymonta 1,98-290 Warta,3021,swarzedz,Tel: 603 846 222,bs-warta.pl
point-24799,Bank Spółdzielczy w Warcie,ul. Klasztorna 1,98-290 Warta,3021,swarzedz,Tel: 43 829-40-19,bs-warta.pl
point-26423,Bank Spółdzielczy w Poddębicach Filia w Niewieszu,Niewiesz 41a,99-200 Poddębice,3021,swarzedz,Tel: 43 678-76-21,bspoddebice.pl
point-25485,Gospodarczy Bank Spółdzielczy w Barlinku Oddział w Pełczycach,Rynek Bursztynowy 5,73-260 Pełczyce,3021,swarzedz,Tel: 95 22 23 410,gbsbank.pl
point-26897,Bank Spółdzielczy w Żaganiu Punkt Obsługi Klienta w Brzeźnicy,ul. Zielonogórska 24A,68-113 Brzeźnica,3021,swarzedz,Tel: 68 360-45-49,bszagan.pl
point-26422,Bank Spółdzielczy w Poddębicach Oddział w Zadzimiu,Zadzim 93,99-232 Zadzim,3021,swarzedz,Tel: 43 678-61-17,bspoddebice.pl
point-26891,Bank Spółdzielczy w Żaganiu Oddział w Nowogrodzie Bobrzańskim,ul. Słowackiego 2,66-010 Nowogród Bobrzański,3021,swarzedz,Tel: 68 321-62-81,bszagan.pl
point-26431,Bank Spółdzielczy w Poddębicach Filia w Sieradzu,ul. Łokietka 3a,98-200 Sieradz,3021,swarzedz,Tel: 43 678-01-64,bspoddebice.pl
point-27210,Warszawski Bank Spółdzielczy Oddział w Sieradzu,ul. Jana Pawła II 3,98-200 Sieradz,3021,swarzedz,Tel: 43 825-01-21,bank-wbs.pl
point-24907,Bank Spółdzielczy w Żaganiu,ul. Skarbowa 6,68-100 Żagań,3021,swarzedz,Tel: 68 368-12-99,bszagan.pl
point-26898,Bank Spółdzielczy w Żaganiu Oddział w Żaganiu,ul. Skarbowa 6,68-100 Żagań,3021,swarzedz,Tel: 68 377-25-16,bszagan.pl
point-26895,Bank Spółdzielczy w Żaganiu Punkt Obsługi Klienta w Żaganiu,ul. Rynek 11,68-100 Żagań,3021,swarzedz,Tel: 68 367-08-75,bszagan.pl
point-26900,Bank Spółdzielczy w Żaganiu POK w Żaganiu,ul. Sportowa 2,68-100 Żagań,3021,swarzedz,Tel: 68 377-03-50,bszagan.pl
