id,name,street,adress,pow_teryt,gmina_town,phone,url
point-26091,Bank Spółdzielczy w Lubaczowie Filia w Tomaszowie Lubelskim,ul. Żwirki i Wigury 2,22-600 Tomaszow Lubelski,0618,tomaszow lubelski,Tel: 84 664-25-80,bslubaczow.pl
point-26086,Bank Spółdzielczy w Lubaczowie Oddział w Tomaszowie Lubelskim,ul. Matejki 2C,37-600 Tomaszów Lubelski,0618,tomaszow lubelski,Tel: 84 664-17-83,bslubaczow.pl
point-26749,Bank Spółdzielczy w Tomaszowie Lubelskim Oddział w Tomaszowie Lubelskim Filia w Tomaszowie Lubelskim,ul. Lwowska 32,22-600 Tomaszów Lubelski,0618,tomaszow lubelski,Tel: 510-292-839,bstomaszowl.pl
point-22950,Bank Spółdzielczy w Tomaszowie Lubelskim,ul. Elizy Orzeszkowej 2,22-600 Tomaszów Lubelski,0618,tomaszow lubelski,Tel: 84 664-44-28,bstomaszowl.pl
point-26748,Bank Spółdzielczy w Tomaszowie Lubelskim Oddział w Tomaszowie Lubelskim,ul. Elizy Orzeszkowej 2,22-600 Tomaszów Lubelski,0618,tomaszow lubelski,Tel: 84 664-44-28,bstomaszowl.pl
