id,name,street,adress,pow_teryt,gmina_town,phone,url
point-27151,Bank Spółdzielczy w Płońsku Bankowy Punkt Obsługi w Ojrzeniu,ul. Ciechanowska 27,06-456 Ojrzeń,1402,sonsk,Tel: 515-422-705,bsplonsk.pl
point-27209,Warszawski Bank Spółdzielczy Oddział w Ciechanowie,ul. Płońska 6,06-400 Ciechanów,1402,sonsk,Tel: 23 652-75-37,bank-wbs.pl
point-27142,Bank Spółdzielczy w Płońsku Oddział w Ciechanowie,ul. 3-go Maja 11,06-400 Ciechanów,1402,sonsk,Tel: 23 672-09-65,bsplonsk.pl
point-25167,Bank Spółdzielczy w Płońsku Oddział w Sochocinie,ul. Sienkiewicza 5,09-110 Sochocin,1402,sonsk,Tel: 23 661-80-11,bsplonsk.pl
point-27150,Bank Spółdzielczy w Płońsku Oddział w Sochocinie Bankowy Punkt Obsługi w Sochocinie,ul. Ciechanowska 4,09-110 Sochocin,1402,sonsk,Tel: 23 661-96-12,bsplonsk.pl
